{"characters":[{"displayName":"Signal Keeper","id":"spv1_chr_df530d723046dc445d152cb7","slug":"signal-keeper","stableKey":"signal-keeper"}],"conditions":[{"id":"spv1_cnd_701f2a4c60bfa3980742dcc1","kind":"transformationState","stableKey":"signal-shore-v1:transformationState","value":"initial","variationId":"spv1_var_60082433e30e81cac406288a"},{"id":"spv1_cnd_8ce1c0c397ce8b3b91f479fe","kind":"philosophy","stableKey":"signal-harbor-v1:philosophy","value":"fixture-complete","variationId":"spv1_var_a98562815b0c3f22efb5bd96"},{"id":"spv1_cnd_b010df45c62206518a5b7c35","kind":"transformationState","stableKey":"signal-crossing-v1:transformationState","value":"revisit","variationId":"spv1_var_8d42eb5fbc14dde4ac43a2ff"},{"id":"spv1_cnd_d1ca4dc9b8d99b2f182f0829","kind":"transformationState","stableKey":"signal-crossing-v2:transformationState","value":"meta","variationId":"spv1_var_cf8da03c235addbc0805c9a5"},{"id":"spv1_cnd_e8ad7d13d03a6788905a7637","kind":"fixtureBand","stableKey":"signal-shore-v1:fixtureBand","value":[1,3],"variationId":"spv1_var_60082433e30e81cac406288a"}],"edges":[{"fromPassageId":"spv1_psg_cd327c5972f60088d56cf327","id":"spv1_edg_0da2529a5d178b1c07541f96","stableKey":"signal-crossing->signal-harbor","toPassageId":"spv1_psg_f564038f113a39258767198c"},{"fromPassageId":"spv1_psg_e66aefeb6ecdf0eca0146f9b","id":"spv1_edg_32e7c3f9686dbbfb85769a14","stableKey":"signal-shore->signal-crossing","toPassageId":"spv1_psg_cd327c5972f60088d56cf327"}],"endings":[{"id":"spv1_end_1c49a02928b48664aa8950eb","passageId":"spv1_psg_f564038f113a39258767198c","stableKey":"signal-harbor"}],"explanations":[{"id":"spv1_exp_186e2a39faaf1cefad075cd9","kind":"fixture-note","stableKey":"tidal-middle-note","subjectId":"spv1_psg_cd327c5972f60088d56cf327","subjectType":"passage","summary":"Marks the synthetic branch between opening and ending."}],"passages":[{"characterId":"spv1_chr_df530d723046dc445d152cb7","id":"spv1_psg_cd327c5972f60088d56cf327","layer":2,"legacyId":"signal-crossing","sourcePath":"content/crossing.json","stableKey":"signal-crossing","title":"Synthetic Crossing"},{"characterId":"spv1_chr_df530d723046dc445d152cb7","id":"spv1_psg_e66aefeb6ecdf0eca0146f9b","layer":1,"legacyId":"signal-shore","sourcePath":"content/shore.json","stableKey":"signal-shore","title":"Synthetic Shore"},{"characterId":"spv1_chr_df530d723046dc445d152cb7","id":"spv1_psg_f564038f113a39258767198c","layer":4,"legacyId":"signal-harbor","sourcePath":"content/harbor.json","stableKey":"signal-harbor","title":"Synthetic Harbor"}],"proseBeats":[{"byteLength":69,"contentDigest":"cd06b35691c5c7cfb25c973063639a8d2a4038ffb7965b76244d6967be2ba95a","id":"spv1_bet_3ce12e0af925bfe28a1b6dd9","ordinal":0,"stableKey":"signal-crossing-v2:0","variationId":"spv1_var_cf8da03c235addbc0805c9a5"},{"byteLength":62,"contentDigest":"3fb036617da317ec9c388e99df9333bb530fe9fc85215add5176430708910561","id":"spv1_bet_9ead9c4be4c62a5b37445634","ordinal":0,"stableKey":"signal-harbor-v1:0","variationId":"spv1_var_a98562815b0c3f22efb5bd96"},{"byteLength":66,"contentDigest":"2f57d59c0c0cba9b12757283a712e66f22e36b88fea93521a320e33c56075bb7","id":"spv1_bet_c62a7371e67701359ccf91c4","ordinal":0,"stableKey":"signal-shore-v1:0","variationId":"spv1_var_60082433e30e81cac406288a"},{"byteLength":66,"contentDigest":"1dc22b5d742bef428029e932fb6381e7dc00adebabc9f47ac87db9b3aca955a4","id":"spv1_bet_d27c57bb8cd05b3d8aa9c9eb","ordinal":0,"stableKey":"signal-crossing-v1:0","variationId":"spv1_var_8d42eb5fbc14dde4ac43a2ff"}],"resources":[{"byteLength":93,"mediaType":"text/plain","path":"assets/note.txt","purpose":"validator resource-integrity fixture","sha256":"6a864fbf77b34b37a7a87ab167827957cdea5bee36ef0e67c7a20b1667af3537"}],"variations":[{"conditionIds":["spv1_cnd_701f2a4c60bfa3980742dcc1","spv1_cnd_e8ad7d13d03a6788905a7637"],"contentDigest":"2f57d59c0c0cba9b12757283a712e66f22e36b88fea93521a320e33c56075bb7","id":"spv1_var_60082433e30e81cac406288a","legacyId":"signal-shore-v1","passageId":"spv1_psg_e66aefeb6ecdf0eca0146f9b","proseBeatIds":["spv1_bet_c62a7371e67701359ccf91c4"],"sourcePath":"content/shore.json","stableKey":"signal-shore-v1"},{"conditionIds":["spv1_cnd_b010df45c62206518a5b7c35"],"contentDigest":"1dc22b5d742bef428029e932fb6381e7dc00adebabc9f47ac87db9b3aca955a4","id":"spv1_var_8d42eb5fbc14dde4ac43a2ff","legacyId":"signal-crossing-v1","passageId":"spv1_psg_cd327c5972f60088d56cf327","proseBeatIds":["spv1_bet_d27c57bb8cd05b3d8aa9c9eb"],"sourcePath":"content/crossing.json","stableKey":"signal-crossing-v1"},{"conditionIds":["spv1_cnd_8ce1c0c397ce8b3b91f479fe"],"contentDigest":"3fb036617da317ec9c388e99df9333bb530fe9fc85215add5176430708910561","id":"spv1_var_a98562815b0c3f22efb5bd96","legacyId":"signal-harbor-v1","passageId":"spv1_psg_f564038f113a39258767198c","proseBeatIds":["spv1_bet_9ead9c4be4c62a5b37445634"],"sourcePath":"content/harbor.json","stableKey":"signal-harbor-v1"},{"conditionIds":["spv1_cnd_d1ca4dc9b8d99b2f182f0829"],"contentDigest":"cd06b35691c5c7cfb25c973063639a8d2a4038ffb7965b76244d6967be2ba95a","id":"spv1_var_cf8da03c235addbc0805c9a5","legacyId":"signal-crossing-v2","passageId":"spv1_psg_cd327c5972f60088d56cf327","proseBeatIds":["spv1_bet_3ce12e0af925bfe28a1b6dd9"],"sourcePath":"content/crossing.json","stableKey":"signal-crossing-v2"}]}
