{"characters":[{"displayName":"Clockmaker","id":"spv1_chr_0a849ce701bc56882978cdbd","slug":"clockmaker","stableKey":"clockmaker"}],"conditions":[{"id":"spv1_cnd_4d5c28bd9156e0b3d4d68a2f","kind":"fixtureChoice","stableKey":"garden-start-v1:fixtureChoice","value":"wind","variationId":"spv1_var_2c2d4240e485e92c8eea5fa0"},{"id":"spv1_cnd_a3c41ea9c8d823973f199e99","kind":"transformationState","stableKey":"garden-start-v1:transformationState","value":"initial","variationId":"spv1_var_2c2d4240e485e92c8eea5fa0"},{"id":"spv1_cnd_c214a0ad4ba5c352c99eecaf","kind":"expression","stableKey":"garden-start-v1:expression","value":{"conditions":[{"kind":"historyStartsWith","passageIds":["garden-start"]},{"condition":{"comparison":"gte","kind":"visitCount","passageId":"garden-return","value":1},"kind":"not"}],"kind":"all"},"variationId":"spv1_var_2c2d4240e485e92c8eea5fa0"},{"id":"spv1_cnd_f6a50336232c47a4d86f67e4","kind":"philosophy","stableKey":"garden-return-v1:philosophy","value":"fixture-complete","variationId":"spv1_var_2cfb280f6fc6f63850768b12"}],"edges":[{"fromPassageId":"spv1_psg_ee30b3aea9f9fcbbdf587107","id":"spv1_edg_94c05078642d70cb1fece84e","stableKey":"garden-start->garden-return","toPassageId":"spv1_psg_49dd24ccff7426605743008c"}],"endings":[{"id":"spv1_end_766c9ee4a5c80c1ad33c3ea8","passageId":"spv1_psg_49dd24ccff7426605743008c","stableKey":"garden-return"}],"explanations":[{"id":"spv1_exp_25d7dce5c416f816a51ee860","kind":"fixture-note","stableKey":"clockwork-opening-note","subjectId":"spv1_psg_ee30b3aea9f9fcbbdf587107","subjectType":"passage","summary":"Opens the synthetic two-passage fixture."}],"passages":[{"characterId":"spv1_chr_0a849ce701bc56882978cdbd","id":"spv1_psg_49dd24ccff7426605743008c","layer":4,"legacyId":"garden-return","sourcePath":"content/end.json","stableKey":"garden-return","title":"Synthetic Ending"},{"characterId":"spv1_chr_0a849ce701bc56882978cdbd","id":"spv1_psg_ee30b3aea9f9fcbbdf587107","layer":1,"legacyId":"garden-start","sourcePath":"content/start.json","stableKey":"garden-start","title":"Synthetic Opening"}],"proseBeats":[{"byteLength":61,"contentDigest":"b5811082f8ae3305f70ceb9933340079513e5de9a322ce3cd18d4ef1186d03ed","id":"spv1_bet_40f05f6e6df8f5061ff3019a","ordinal":0,"stableKey":"garden-start-v1:0","variationId":"spv1_var_2c2d4240e485e92c8eea5fa0"},{"byteLength":73,"contentDigest":"44b248cb34a0729461ef101c5fda25892a0f49d5876d6e7029ab130493737517","id":"spv1_bet_76e2dd164b0bab3cd3eb5fdc","ordinal":0,"stableKey":"garden-return-v1:0","variationId":"spv1_var_2cfb280f6fc6f63850768b12"}],"resources":[{"byteLength":81,"mediaType":"text/plain","path":"assets/note.txt","purpose":"validator resource-integrity fixture","sha256":"6c80e9cb95995a28b6655bb9d8939d40c8f8ae31b73535c67c6fc30179313146"}],"variations":[{"conditionIds":["spv1_cnd_4d5c28bd9156e0b3d4d68a2f","spv1_cnd_a3c41ea9c8d823973f199e99","spv1_cnd_c214a0ad4ba5c352c99eecaf"],"contentDigest":"b5811082f8ae3305f70ceb9933340079513e5de9a322ce3cd18d4ef1186d03ed","id":"spv1_var_2c2d4240e485e92c8eea5fa0","legacyId":"garden-start-v1","passageId":"spv1_psg_ee30b3aea9f9fcbbdf587107","proseBeatIds":["spv1_bet_40f05f6e6df8f5061ff3019a"],"sourcePath":"content/start.json","stableKey":"garden-start-v1"},{"conditionIds":["spv1_cnd_f6a50336232c47a4d86f67e4"],"contentDigest":"44b248cb34a0729461ef101c5fda25892a0f49d5876d6e7029ab130493737517","id":"spv1_var_2cfb280f6fc6f63850768b12","legacyId":"garden-return-v1","passageId":"spv1_psg_49dd24ccff7426605743008c","proseBeatIds":["spv1_bet_76e2dd164b0bab3cd3eb5fdc"],"sourcePath":"content/end.json","stableKey":"garden-return-v1"}]}
